{
  "schema_version": "closure-v1",
  "sidecar_id": "DOKA20-P31-REFERENCE",
  "records": [
    {
      "manufacturer": "Doka",
      "system_ref": "DOKA_RINGLOCK_2020_11",
      "source_id": "DOKA-RL-2020",
      "source_pdf_page": 31,
      "source_edition": "11/2020",
      "rating_scope": "COMPONENT_REFERENCE_NOT_COMPLETE_SHORING_CONFIGURATION",
      "source_basis_text": "Heading: Maximum Design Forces; note: All permissable loads with gammaM=1.1 and gammaF=1.5",
      "source_gamma_M": 1.1,
      "source_gamma_F": 1.5,
      "basis_mapping_status": "ENGINEER_CONFIRMATION_REQUIRED",
      "automatic_design_use": false,
      "interpolation_allowed": false,
      "extrapolation_allowed": false,
      "rating_id": "DOKA20-STD-LIFT-500",
      "kind": "STANDARD",
      "selector": {
        "ledger_vertical_spacing_mm": 500
      },
      "limits": {
        "compression_kN": 62,
        "tension_kN": 56
      },
      "conditions": [
        "Proper ledger and bay-brace connections required for compression.",
        "Leg-lock connection required for tension.",
        "Ledger spacing is NOT total tower height.",
        "Head/base extension, global tower configuration and actual product identity not established by this row."
      ]
    },
    {
      "manufacturer": "Doka",
      "system_ref": "DOKA_RINGLOCK_2020_11",
      "source_id": "DOKA-RL-2020",
      "source_pdf_page": 31,
      "source_edition": "11/2020",
      "rating_scope": "COMPONENT_REFERENCE_NOT_COMPLETE_SHORING_CONFIGURATION",
      "source_basis_text": "Heading: Maximum Design Forces; note: All permissable loads with gammaM=1.1 and gammaF=1.5",
      "source_gamma_M": 1.1,
      "source_gamma_F": 1.5,
      "basis_mapping_status": "ENGINEER_CONFIRMATION_REQUIRED",
      "automatic_design_use": false,
      "interpolation_allowed": false,
      "extrapolation_allowed": false,
      "rating_id": "DOKA20-STD-LIFT-1000",
      "kind": "STANDARD",
      "selector": {
        "ledger_vertical_spacing_mm": 1000
      },
      "limits": {
        "compression_kN": 55,
        "tension_kN": 56
      },
      "conditions": [
        "Proper ledger and bay-brace connections required for compression.",
        "Leg-lock connection required for tension.",
        "Ledger spacing is NOT total tower height.",
        "Head/base extension, global tower configuration and actual product identity not established by this row."
      ]
    },
    {
      "manufacturer": "Doka",
      "system_ref": "DOKA_RINGLOCK_2020_11",
      "source_id": "DOKA-RL-2020",
      "source_pdf_page": 31,
      "source_edition": "11/2020",
      "rating_scope": "COMPONENT_REFERENCE_NOT_COMPLETE_SHORING_CONFIGURATION",
      "source_basis_text": "Heading: Maximum Design Forces; note: All permissable loads with gammaM=1.1 and gammaF=1.5",
      "source_gamma_M": 1.1,
      "source_gamma_F": 1.5,
      "basis_mapping_status": "ENGINEER_CONFIRMATION_REQUIRED",
      "automatic_design_use": false,
      "interpolation_allowed": false,
      "extrapolation_allowed": false,
      "rating_id": "DOKA20-STD-LIFT-1500",
      "kind": "STANDARD",
      "selector": {
        "ledger_vertical_spacing_mm": 1500
      },
      "limits": {
        "compression_kN": 43,
        "tension_kN": 56
      },
      "conditions": [
        "Proper ledger and bay-brace connections required for compression.",
        "Leg-lock connection required for tension.",
        "Ledger spacing is NOT total tower height.",
        "Head/base extension, global tower configuration and actual product identity not established by this row."
      ]
    },
    {
      "manufacturer": "Doka",
      "system_ref": "DOKA_RINGLOCK_2020_11",
      "source_id": "DOKA-RL-2020",
      "source_pdf_page": 31,
      "source_edition": "11/2020",
      "rating_scope": "COMPONENT_REFERENCE_NOT_COMPLETE_SHORING_CONFIGURATION",
      "source_basis_text": "Heading: Maximum Design Forces; note: All permissable loads with gammaM=1.1 and gammaF=1.5",
      "source_gamma_M": 1.1,
      "source_gamma_F": 1.5,
      "basis_mapping_status": "ENGINEER_CONFIRMATION_REQUIRED",
      "automatic_design_use": false,
      "interpolation_allowed": false,
      "extrapolation_allowed": false,
      "rating_id": "DOKA20-STD-LIFT-2000",
      "kind": "STANDARD",
      "selector": {
        "ledger_vertical_spacing_mm": 2000
      },
      "limits": {
        "compression_kN": 29,
        "tension_kN": 56
      },
      "conditions": [
        "Proper ledger and bay-brace connections required for compression.",
        "Leg-lock connection required for tension.",
        "Ledger spacing is NOT total tower height.",
        "Head/base extension, global tower configuration and actual product identity not established by this row."
      ]
    },
    {
      "manufacturer": "Doka",
      "system_ref": "DOKA_RINGLOCK_2020_11",
      "source_id": "DOKA-RL-2020",
      "source_pdf_page": 31,
      "source_edition": "11/2020",
      "rating_scope": "COMPONENT_REFERENCE_NOT_COMPLETE_SHORING_CONFIGURATION",
      "source_basis_text": "Heading: Maximum Design Forces; note: All permissable loads with gammaM=1.1 and gammaF=1.5",
      "source_gamma_M": 1.1,
      "source_gamma_F": 1.5,
      "basis_mapping_status": "ENGINEER_CONFIRMATION_REQUIRED",
      "automatic_design_use": false,
      "interpolation_allowed": false,
      "extrapolation_allowed": false,
      "rating_id": "DOKA20-STD-LIFT-2500",
      "kind": "STANDARD",
      "selector": {
        "ledger_vertical_spacing_mm": 2500
      },
      "limits": {
        "compression_kN": 19.2,
        "tension_kN": 56
      },
      "conditions": [
        "Proper ledger and bay-brace connections required for compression.",
        "Leg-lock connection required for tension.",
        "Ledger spacing is NOT total tower height.",
        "Head/base extension, global tower configuration and actual product identity not established by this row."
      ]
    },
    {
      "manufacturer": "Doka",
      "system_ref": "DOKA_RINGLOCK_2020_11",
      "source_id": "DOKA-RL-2020",
      "source_pdf_page": 31,
      "source_edition": "11/2020",
      "rating_scope": "COMPONENT_REFERENCE_NOT_COMPLETE_SHORING_CONFIGURATION",
      "source_basis_text": "Heading: Maximum Design Forces; note: All permissable loads with gammaM=1.1 and gammaF=1.5",
      "source_gamma_M": 1.1,
      "source_gamma_F": 1.5,
      "basis_mapping_status": "ENGINEER_CONFIRMATION_REQUIRED",
      "automatic_design_use": false,
      "interpolation_allowed": false,
      "extrapolation_allowed": false,
      "rating_id": "DOKA20-STD-LIFT-3000",
      "kind": "STANDARD",
      "selector": {
        "ledger_vertical_spacing_mm": 3000
      },
      "limits": {
        "compression_kN": 13,
        "tension_kN": 56
      },
      "conditions": [
        "Proper ledger and bay-brace connections required for compression.",
        "Leg-lock connection required for tension.",
        "Ledger spacing is NOT total tower height.",
        "Head/base extension, global tower configuration and actual product identity not established by this row."
      ]
    },
    {
      "manufacturer": "Doka",
      "system_ref": "DOKA_RINGLOCK_2020_11",
      "source_id": "DOKA-RL-2020",
      "source_pdf_page": 31,
      "source_edition": "11/2020",
      "rating_scope": "COMPONENT_REFERENCE_NOT_COMPLETE_SHORING_CONFIGURATION",
      "source_basis_text": "Heading: Maximum Design Forces; note: All permissable loads with gammaM=1.1 and gammaF=1.5",
      "source_gamma_M": 1.1,
      "source_gamma_F": 1.5,
      "basis_mapping_status": "ENGINEER_CONFIRMATION_REQUIRED",
      "automatic_design_use": false,
      "interpolation_allowed": false,
      "extrapolation_allowed": false,
      "rating_id": "DOKA20-BRACE-2000-730",
      "kind": "BRACE",
      "selector": {
        "lift_mm": 2000,
        "bay_mm": 730
      },
      "limits": {
        "tension_kN": 12.2,
        "compression_kN": 11.9
      },
      "conditions": [
        "Exact 2.0m lift and listed bay only.",
        "Axial brace action Nyz as source sketch.",
        "Not ledger force or global lateral tower capacity."
      ]
    },
    {
      "manufacturer": "Doka",
      "system_ref": "DOKA_RINGLOCK_2020_11",
      "source_id": "DOKA-RL-2020",
      "source_pdf_page": 31,
      "source_edition": "11/2020",
      "rating_scope": "COMPONENT_REFERENCE_NOT_COMPLETE_SHORING_CONFIGURATION",
      "source_basis_text": "Heading: Maximum Design Forces; note: All permissable loads with gammaM=1.1 and gammaF=1.5",
      "source_gamma_M": 1.1,
      "source_gamma_F": 1.5,
      "basis_mapping_status": "ENGINEER_CONFIRMATION_REQUIRED",
      "automatic_design_use": false,
      "interpolation_allowed": false,
      "extrapolation_allowed": false,
      "rating_id": "DOKA20-BRACE-2000-1090",
      "kind": "BRACE",
      "selector": {
        "lift_mm": 2000,
        "bay_mm": 1090
      },
      "limits": {
        "tension_kN": 12.2,
        "compression_kN": 11.9
      },
      "conditions": [
        "Exact 2.0m lift and listed bay only.",
        "Axial brace action Nyz as source sketch.",
        "Not ledger force or global lateral tower capacity."
      ]
    },
    {
      "manufacturer": "Doka",
      "system_ref": "DOKA_RINGLOCK_2020_11",
      "source_id": "DOKA-RL-2020",
      "source_pdf_page": 31,
      "source_edition": "11/2020",
      "rating_scope": "COMPONENT_REFERENCE_NOT_COMPLETE_SHORING_CONFIGURATION",
      "source_basis_text": "Heading: Maximum Design Forces; note: All permissable loads with gammaM=1.1 and gammaF=1.5",
      "source_gamma_M": 1.1,
      "source_gamma_F": 1.5,
      "basis_mapping_status": "ENGINEER_CONFIRMATION_REQUIRED",
      "automatic_design_use": false,
      "interpolation_allowed": false,
      "extrapolation_allowed": false,
      "rating_id": "DOKA20-BRACE-2000-1400",
      "kind": "BRACE",
      "selector": {
        "lift_mm": 2000,
        "bay_mm": 1400
      },